{
  "schemaVersion": 1,
  "clientId": "kimberly-james-bridal",
  "requesterRefs": ["registry-contact:kimberly-james-bridal:0", "user:dillon"],
  "loginIdentityRefs": [
    "access-broker:dillon-operations/google-ads-immohrtal-browser",
    "access-broker:dillon-operations/meta-ads-immohrtal-browser"
  ],
  "platforms": {
    "google_ads": {
      "enabledForPlanning": true,
      "exactAccountRef": "access-broker:kimberly-james-bridal/google-ads-production",
      "exactAccountIdSha256": "37745d05bdd0ad13da1bfc8ad94e0dcd7e99e2061a97062711052d38340464e4",
      "executionSurface": "persistent_chrome",
      "launchBlueprintRef": "clients/kimberly-james-bridal/paid-media/blueprints/google_ads.json"
    },
    "meta_ads": {
      "enabledForPlanning": true,
      "exactAccountRef": "access-broker:kimberly-james-bridal/meta-ads-production-1249689223687250",
      "exactAccountIdSha256": "62a7dd100006586fbf2707d49afb8e74095f2d1e84fc55b2d9468dfe2d4d3cad",
      "executionSurface": "persistent_chrome",
      "launchBlueprintRef": "clients/kimberly-james-bridal/paid-media/blueprints/meta_ads.json"
    }
  },
  "locationPolicy": {
    "scope": "approved_market",
    "source": "Use only the market and appointment path established by exact current KJB evidence.",
    "mixedBrandLocationsForbidden": true
  },
  "landingPage": {
    "defaultMode": "reuse",
    "sourceRef": null,
    "stagingDeploymentRef": null,
    "productionDeploymentRef": null,
    "status": "partial"
  },
  "currentStateRules": [
    "Google was live-read as enabled on July 16; stale pause context must not override the current exact-account readback.",
    "Use the primary KJB account only and exclude the cancelled duplicate KJB (New) route.",
    "Meta is live-mapped with active website traffic and retargeting campaigns; keep the observed Leads carousel draft unchanged unless exact authority covers a change.",
    "Never count tests as leads, appointments, or bookings.",
    "Use qualified conversations and booked appointments as the downstream quality signals."
  ],
  "providerReadinessRef": "state/ad-provider-readiness.json",
  "privacy": "redacted",
  "containsSecrets": false,
  "containsDirectIdentifiers": false,
  "containsRawCommunications": false
}
